### ISSUE TITLE
kcp.NewConn()的问题

### ISSUE THREAD

**Issue by kncxstudio** [xtaci/kcp-go#105]
在server.go:
```
laddr := &net.UDPAddr{IP:net.ParseIP("192.168.1.4"), Port: ListenPort}
server, err := kcp.ServeConn(nil,0,0,conn)
```

在client.go
```
dstAddr := &net.UDPAddr{IP: net.ParseIP(ServerIP), Port: ServerPort}
srcAddr := &net.UDPAddr{IP: net.ParseIP(ClientIP), Port: 1223} 
conn, err := net.DialUDP("udp", srcAddr, dstAddr)
clientSess, err := kcp.NewConn(dstAddr.String(),nil,0,0,conn)
clientSess.Write([]byte("1111111111111111"))
```
在服务端无法收到来自客户端的消息，抓包也未发送任何包

而如果client.go使用这种方式：
```
clientSess, err := kcp.DialWithOptions(dstAddr.String(),nil,0,0)
clientSess.Write([]byte("1111111111111111"))
```
则可以正常收包。但是这样就无法指定本地的udp端口

请问第一种client.go的用法有什么问题吗？

**Comment by jimmy9065** [comment]
第一种看起来是对的, 应该可以工作. 我这里和你差不多, 你是否检查了UDP的dial和kcp的NewConn是否都成功了

**Comment by kncxstudio** [comment]
@jimmy9065 可以通过netstat查看到对应端口已经打开。但是抓包没数据

**Comment by jimmy9065** [comment]
我的意思是看你的代码里你都没有check err, 不知道是不是你贴上来省略了。我这里也写了小例子运行了一下也是正确的。
我贴下我的代码给你参考下
**Client:**
<pre>
func main() {
	rAddr, err := net.ResolveUDPAddr("udp", "localhost:9000")
	if err != nil {
		panic(err)
	}

	lAddr, err := net.ResolveUDPAddr("udp", "localhost:10000")
	if err != nil {
		panic(err)
	}

	udpConn, err := net.DialUDP("udp", lAddr, rAddr)
	if err != nil {
		panic(err)
	}
	defer udpConn.Close()

	kcpConn, err := kcp.NewConn(rAddr.String(), nil, 0, 0, udpConn)
	if err != nil {
		log.Fatalln("Error:", err)
	}
	defer kcpConn.Close()

	if _, err := kcpConn.Write([]byte("hello")); err != nil {
		panic(err)
	}
}
</pre>

**Server:**
<pre>
func main() {
	l, err := kcp.Listen("localhost:9000")
	if err != nil {
		log.Fatalln("Error:", err)
	}

	for {
		conn, err := l.Accept()
		if err != nil {
			log.Fatalln(err)
		}

		buf := make([]byte, 100)
		go func() {
			for {
				n, err := conn.Read(buf)
				if err != nil {
					log.Println("fail to read:", err)
				}
				log.Println("received:", string(buf[:n]))
			}
		}()
	}
}
</pre>

我是觉得没什么区别， 这个是我的tcpdum抓包：
<pre>
11:12:16.435431 IP localhost.45974 > localhost.cslistener: UDP, length 37
11:12:19.639591 IP localhost.45974 > localhost.cslistener: UDP, length 37
11:12:23.044253 IP localhost.45974 > localhost.cslistener: UDP, length 37
11:12:26.649047 IP localhost.45974 > localhost.cslistener: UDP, length 37
11:12:30.453807 IP localhost.45974 > localhost.cslistener: UDP, length 37
</pre>

另外你有试过，直接用UDP发包是否能受到么？排除下系统的限制。

**Comment by jimmy9065** [comment]
不知道你的完整代码，不过突然想起来一件事。不知道你有没有看过源码， 这个Write函数并不是阻塞的，如果你在write之后马上退出的话， 这个包你不一定发的出去的哟

**Comment by kncxstudio** [comment]
@jimmy9065 原封不动的复制代码跑了一下。确认端口打开了，抓不到包，有panic产生

panic: i/o timeout

goroutine 1 [running]:
main.main()
	D:/Projects/src/kcp-test/client/client.go:37 +0x3b0

go version为 go1.11 windows/amd64


在macOS下测试也是同样的效果

**Comment by xtaci** [comment]
connected udp不能用WriteTo的， 你可以试试直接在client.go里面ListenUDP，用这个UDPConn传入NewConn

**Comment by kncxstudio** [comment]
@jimmy9065 直接UDP是正常的

@xtaci 没有使用WriteTo()，全部使用的Write()。直接在client.go里面ListenUDP()，然后传入这个conn就可以了。但是为什么传入使用DialUDP()的UDPConn却不行?

**Comment by jimmy9065** [comment]
奥不好意思， 用的是自己fork的库，我查了下发现这里做过修改。。。我忘记了。
我的NewConn里吧net.UDPConn转化成了connectedUDPConn了， 这个类会吧WriteTo转化成Write.
Sorry～

**Comment by jimmy9065** [comment]
@xtaci 这里想请教一下，既然NewConn不能使用connectConn, 为什么不在这个方法里直接把net.UDPConn给包装一下屏蔽掉WriteTo呢？ 是有别的设计用意吗？谢谢

**Comment by kncxstudio** [comment]
@xtaci 感谢解答
